{
  "$schema": "https://json-schema.org/draft/2020-12/schema",
  "title": "Mambo AresPlot Read-Only Capture Configuration",
  "type": "object",
  "required": [
    "serial_port",
    "baud_rate",
    "duration_seconds",
    "output_csv",
    "variables"
  ],
  "properties": {
    "serial_port": {
      "type": "string",
      "minLength": 1
    },
    "baud_rate": {
      "type": "integer",
      "minimum": 1
    },
    "sample_rate_hz": {
      "type": "integer",
      "minimum": 1,
      "maximum": 1000
    },
    "sample_period_ms": {
      "type": "integer",
      "minimum": 1
    },
    "duration_seconds": {
      "type": "number",
      "exclusiveMinimum": 0
    },
    "output_csv": {
      "type": "string",
      "minLength": 1
    },
    "ack_timeout_seconds": {
      "type": "number",
      "exclusiveMinimum": 0
    },
    "max_frame_bytes": {
      "type": "integer",
      "minimum": 64,
      "maximum": 512
    },
    "max_variables": {
      "type": "integer",
      "minimum": 1,
      "maximum": 50
    },
    "address_ranges": {
      "type": "array",
      "minItems": 1,
      "items": {
        "type": "object",
        "required": ["start", "end"],
        "properties": {
          "start": {
            "$ref": "#/$defs/address"
          },
          "end": {
            "$ref": "#/$defs/address"
          }
        },
        "additionalProperties": false
      }
    },
    "variables": {
      "type": "array",
      "minItems": 1,
      "items": {
        "type": "object",
        "required": ["name", "address", "type"],
        "properties": {
          "name": {
            "type": "string",
            "minLength": 1
          },
          "address": {
            "$ref": "#/$defs/address"
          },
          "type": {
            "enum": [
              "int8",
              "uint8",
              "int16",
              "uint16",
              "int32",
              "uint32",
              "float32",
              "bool"
            ]
          }
        },
        "additionalProperties": false
      }
    }
  },
  "allOf": [
    {
      "oneOf": [
        {
          "required": ["sample_rate_hz"],
          "not": {
            "required": ["sample_period_ms"]
          }
        },
        {
          "required": ["sample_period_ms"],
          "not": {
            "required": ["sample_rate_hz"]
          }
        }
      ]
    }
  ],
  "additionalProperties": false,
  "$defs": {
    "address": {
      "oneOf": [
        {
          "type": "integer",
          "minimum": 0,
          "maximum": 4294967295
        },
        {
          "type": "string",
          "pattern": "^(0x[0-9a-fA-F]+|[0-9]+)$"
        }
      ]
    }
  }
}
